{
  "$schema": "https://json-schema.org/draft/2020-12/schema",
  "$id": "https://grandchallenge.dev/intellect/schemas/council_motion_disposition.schema.json",
  "title": "Grand Intellect unanimous-motion disposition",
  "type": "object",
  "additionalProperties": false,
  "required": ["schema_version", "matter_id", "motion_sha256", "full_quorum", "unanimous", "office_dispositions", "review_sha256", "procedural_disposition", "current_rules_remain_effective", "authority_boundary"],
  "properties": {
    "schema_version": {"const": "1.0"},
    "matter_id": {"type": "string", "minLength": 1},
    "motion_sha256": {"type": "string", "pattern": "^[0-9a-f]{64}$"},
    "full_quorum": {"const": true},
    "unanimous": {"type": "boolean"},
    "office_dispositions": {"type": "object", "minProperties": 10, "maxProperties": 10, "additionalProperties": {"enum": ["table_for_human_steward_disposition", "convene_governance_rework_committee", "reject", "abstain"]}},
    "review_sha256": {"type": "object", "minProperties": 10, "maxProperties": 10, "additionalProperties": {"type": "string", "pattern": "^[0-9a-f]{64}$"}},
    "procedural_disposition": {"enum": ["table_for_human_steward_disposition", "convene_governance_rework_committee", "no_unanimous_disposition"]},
    "current_rules_remain_effective": {"const": true},
    "authority_boundary": {"type": "string", "minLength": 1}
  }
}
