{
  "authority_boundary": "This compilation records Council procedure. It does not create human authorization, amend, merge, activate, ratify, or certify.",
  "current_rules_remain_effective": true,
  "full_quorum": true,
  "matter_id": "GI-COUNCIL-PROXY-DELEGATION-SCHEDULE-001",
  "motion_sha256": "50c33099246c7780547c1d3d81b817e338c4680fbbd6f4bd770459baeecd917e",
  "office_dispositions": {
    "adversary": "table_for_human_steward_disposition",
    "amanuensis": "table_for_human_steward_disposition",
    "axiomatist": "table_for_human_steward_disposition",
    "cartographer": "table_for_human_steward_disposition",
    "composer": "table_for_human_steward_disposition",
    "formalist": "table_for_human_steward_disposition",
    "grammarian": "table_for_human_steward_disposition",
    "referee": "table_for_human_steward_disposition",
    "steward": "table_for_human_steward_disposition",
    "verifier": "table_for_human_steward_disposition"
  },
  "procedural_disposition": "table_for_human_steward_disposition",
  "review_sha256": {
    "adversary": "e9330fa2cb84abbc9f6ccac93599c210b3bd19248374fe8e5cfddf65e190f49a",
    "amanuensis": "ff211a6405a32e54df2a1d4da5285a7b5e15a47056a52f8a70993a22fec18564",
    "axiomatist": "05e8eb9f9859a44d0c073ea0b52d76f924c495f33c7b82da2ada13601a3df826",
    "cartographer": "f9bf24124f1204d729b739f1c5df82e951877f7363563843f84bb1f5e2a1aa0a",
    "composer": "a8cd16ee4b4fda46d3f2ded8ffd44a53740636aba1027d2194eb8958fd663ca7",
    "formalist": "e7def55f0015b9e2e7566646b25623cc2a6e5dd8342e0ff9aa260eafa8d0c9ec",
    "grammarian": "96d083816f3e23ad6de180f380d7e83d1011b16fb38d4dda15e85e68aa1c2893",
    "referee": "f034a0224f2d9735d2b89ea4546ff2beb79042ed9c68e1d1e9557546ac350cba",
    "steward": "206ae7568fbea043dbf347cdd9dde5671a2d7044cb593988c49b9c0916740be7",
    "verifier": "a4b0a9d4ef37c42c8cd7e9df19205d914f316f708e284b359c989a4dae56ca16"
  },
  "schema_version": "1.0",
  "unanimous": true
}
